[
  {
    "id": 1,
    "name": "Chicken Karahi",
    "description": "",
    "cuisine": "Pakistani",
    "country": "",
    "region": "Punjab",
    "meal_type": "Dinner",
    "course": "",
    "difficulty": "Medium",
    "prep_time_minutes": 15,
    "cook_time_minutes": 35,
    "total_time_minutes": 50,
    "servings": 4,
    "ingredients": [
      {
        "name": "750 g chicken, bone-in",
        "quantity": 1,
        "unit": "",
        "aisle": "Other",
        "notes": ""
      },
      {
        "name": "4 tomatoes, chopped",
        "quantity": 1,
        "unit": "",
        "aisle": "Other",
        "notes": ""
      },
      {
        "name": "4 cloves garlic, minced",
        "quantity": 1,
        "unit": "",
        "aisle": "Other",
        "notes": ""
      },
      {
        "name": "1 tbsp ginger, julienned",
        "quantity": 1,
        "unit": "",
        "aisle": "Other",
        "notes": ""
      },
      {
        "name": "2 green chilies, sliced",
        "quantity": 1,
        "unit": "",
        "aisle": "Other",
        "notes": ""
      },
      {
        "name": "1 tsp red chili powder",
        "quantity": 1,
        "unit": "",
        "aisle": "Other",
        "notes": ""
      },
      {
        "name": "1 tsp cumin powder",
        "quantity": 1,
        "unit": "",
        "aisle": "Other",
        "notes": ""
      },
      {
        "name": "1 tsp coriander powder",
        "quantity": 1,
        "unit": "",
        "aisle": "Other",
        "notes": ""
      },
      {
        "name": "1/2 tsp black pepper",
        "quantity": 1,
        "unit": "",
        "aisle": "Other",
        "notes": ""
      },
      {
        "name": "1/2 tsp garam masala",
        "quantity": 1,
        "unit": "",
        "aisle": "Other",
        "notes": ""
      },
      {
        "name": "1/2 cup cooking oil",
        "quantity": 1,
        "unit": "",
        "aisle": "Other",
        "notes": ""
      },
      {
        "name": "Salt to taste",
        "quantity": 1,
        "unit": "",
        "aisle": "Other",
        "notes": ""
      },
      {
        "name": "Fresh cilantro for garnish",
        "quantity": 1,
        "unit": "",
        "aisle": "Other",
        "notes": ""
      }
    ],
    "steps": [
      "Heat oil in a karahi or wok.",
      "Add chicken and fry until lightly browned.",
      "Stir in garlic and cook for 1 minute.",
      "Add tomatoes, salt, and powdered spices.",
      "Cook uncovered until tomatoes break down and oil separates.",
      "Add green chilies and ginger.",
      "Sprinkle garam masala and simmer for 5 minutes.",
      "Garnish with cilantro and serve with naan."
    ],
    "tags": [],
    "diet_flags": [],
    "allergens": [],
    "halal_haram_status": "Mashbooh",
    "halal_haram_reason": "",
    "nutrition_per_serving": {
      "calories": 0,
      "protein_g": 0,
      "carbs_g": 0,
      "fat_g": 0,
      "fiber_g": 0,
      "sugar_g": 0,
      "sodium_mg": 0,
      "saturated_fat_g": 0
    },
    "nutrition_estimated": true,
    "image_query": "Chicken Karahi",
    "image_url": "",
    "rating": 0,
    "review_count": 0,
    "author": "AI-generated",
    "created_at": "2026-06-28T13:18:20.586900+00:00"
  },
  {
    "id": 2,
    "name": "Nihari",
    "description": "",
    "cuisine": "Pakistani",
    "country": "",
    "region": "Karachi",
    "meal_type": "Dinner",
    "course": "",
    "difficulty": "Medium",
    "prep_time_minutes": 20,
    "cook_time_minutes": 180,
    "total_time_minutes": 200,
    "servings": 6,
    "ingredients": [
      {
        "name": "1 kg beef shank",
        "quantity": 1,
        "unit": "",
        "aisle": "Other",
        "notes": ""
      },
      {
        "name": "2 onions, sliced",
        "quantity": 1,
        "unit": "",
        "aisle": "Other",
        "notes": ""
      },
      {
        "name": "4 tbsp ghee",
        "quantity": 1,
        "unit": "",
        "aisle": "Other",
        "notes": ""
      },
      {
        "name": "2 tbsp ginger-garlic paste",
        "quantity": 1,
        "unit": "",
        "aisle": "Other",
        "notes": ""
      },
      {
        "name": "2 tbsp nihari spice mix",
        "quantity": 1,
        "unit": "",
        "aisle": "Other",
        "notes": ""
      },
      {
        "name": "2 tbsp flour",
        "quantity": 1,
        "unit": "",
        "aisle": "Other",
        "notes": ""
      },
      {
        "name": "6 cups water",
        "quantity": 1,
        "unit": "",
        "aisle": "Other",
        "notes": ""
      },
      {
        "name": "Salt to taste",
        "quantity": 1,
        "unit": "",
        "aisle": "Other",
        "notes": ""
      },
      {
        "name": "Julienned ginger",
        "quantity": 1,
        "unit": "",
        "aisle": "Other",
        "notes": ""
      },
      {
        "name": "Green chilies",
        "quantity": 1,
        "unit": "",
        "aisle": "Other",
        "notes": ""
      },
      {
        "name": "Fresh cilantro",
        "quantity": 1,
        "unit": "",
        "aisle": "Other",
        "notes": ""
      },
      {
        "name": "Lemon wedges",
        "quantity": 1,
        "unit": "",
        "aisle": "Other",
        "notes": ""
      }
    ],
    "steps": [
      "Heat ghee and fry onions until golden.",
      "Add ginger-garlic paste and beef.",
      "Cook for 10 minutes before adding spice mix.",
      "Pour in water and simmer for about 3 hours until tender.",
      "Mix flour with water and stir into the curry.",
      "Cook until thickened.",
      "Serve with ginger, cilantro, chilies, and lemon."
    ],
    "tags": [],
    "diet_flags": [],
    "allergens": [],
    "halal_haram_status": "Mashbooh",
    "halal_haram_reason": "",
    "nutrition_per_serving": {
      "calories": 0,
      "protein_g": 0,
      "carbs_g": 0,
      "fat_g": 0,
      "fiber_g": 0,
      "sugar_g": 0,
      "sodium_mg": 0,
      "saturated_fat_g": 0
    },
    "nutrition_estimated": true,
    "image_query": "Nihari",
    "image_url": "",
    "rating": 0,
    "review_count": 0,
    "author": "AI-generated",
    "created_at": "2026-06-28T13:18:20.588888+00:00"
  },
  {
    "id": 3,
    "name": "Sindhi Biryani",
    "description": "",
    "cuisine": "Pakistani",
    "country": "",
    "region": "Sindh",
    "meal_type": "Dinner",
    "course": "",
    "difficulty": "Medium",
    "prep_time_minutes": 30,
    "cook_time_minutes": 60,
    "total_time_minutes": 90,
    "servings": 6,
    "ingredients": [
      {
        "name": "500 g chicken",
        "quantity": 1,
        "unit": "",
        "aisle": "Other",
        "notes": ""
      },
      {
        "name": "3 cups basmati rice",
        "quantity": 1,
        "unit": "",
        "aisle": "Other",
        "notes": ""
      },
      {
        "name": "2 potatoes, halved",
        "quantity": 1,
        "unit": "",
        "aisle": "Other",
        "notes": ""
      },
      {
        "name": "2 onions, sliced",
        "quantity": 1,
        "unit": "",
        "aisle": "Other",
        "notes": ""
      },
      {
        "name": "2 tomatoes, chopped",
        "quantity": 1,
        "unit": "",
        "aisle": "Other",
        "notes": ""
      },
      {
        "name": "1/2 cup yogurt",
        "quantity": 1,
        "unit": "",
        "aisle": "Other",
        "notes": ""
      },
      {
        "name": "2 tbsp ginger-garlic paste",
        "quantity": 1,
        "unit": "",
        "aisle": "Other",
        "notes": ""
      },
      {
        "name": "2 tbsp Sindhi biryani masala",
        "quantity": 1,
        "unit": "",
        "aisle": "Other",
        "notes": ""
      },
      {
        "name": "1/4 cup oil",
        "quantity": 1,
        "unit": "",
        "aisle": "Other",
        "notes": ""
      },
      {
        "name": "Fresh mint",
        "quantity": 1,
        "unit": "",
        "aisle": "Other",
        "notes": ""
      },
      {
        "name": "Fresh cilantro",
        "quantity": 1,
        "unit": "",
        "aisle": "Other",
        "notes": ""
      },
      {
        "name": "Green chilies",
        "quantity": 1,
        "unit": "",
        "aisle": "Other",
        "notes": ""
      },
      {
        "name": "Saffron milk",
        "quantity": 1,
        "unit": "",
        "aisle": "Other",
        "notes": ""
      },
      {
        "name": "Salt",
        "quantity": 1,
        "unit": "",
        "aisle": "Other",
        "notes": ""
      }
    ],
    "steps": [
      "Parboil rice until 70% cooked.",
      "Fry potatoes until golden.",
      "Cook onions until browned.",
      "Add chicken, ginger-garlic paste, tomatoes, yogurt, and spices.",
      "Cook until chicken is tender.",
      "Layer rice over chicken.",
      "Top with potatoes, herbs, chilies, and saffron milk.",
      "Steam on low heat for 20 minutes before serving."
    ],
    "tags": [],
    "diet_flags": [],
    "allergens": [],
    "halal_haram_status": "Mashbooh",
    "halal_haram_reason": "",
    "nutrition_per_serving": {
      "calories": 0,
      "protein_g": 0,
      "carbs_g": 0,
      "fat_g": 0,
      "fiber_g": 0,
      "sugar_g": 0,
      "sodium_mg": 0,
      "saturated_fat_g": 0
    },
    "nutrition_estimated": true,
    "image_query": "Sindhi Biryani",
    "image_url": "",
    "rating": 0,
    "review_count": 0,
    "author": "AI-generated",
    "created_at": "2026-06-28T13:18:20.590954+00:00"
  },
  {
    "id": 4,
    "name": "Chapli Kebab",
    "description": "",
    "cuisine": "Pakistani",
    "country": "",
    "region": "Khyber Pakhtunkhwa",
    "meal_type": "Dinner",
    "course": "",
    "difficulty": "Medium",
    "prep_time_minutes": 20,
    "cook_time_minutes": 15,
    "total_time_minutes": 35,
    "servings": 4,
    "ingredients": [
      {
        "name": "500 g minced beef",
        "quantity": 1,
        "unit": "",
        "aisle": "Other",
        "notes": ""
      },
      {